{
  "tool_type": "publisher",
  "tool_title": "File Publisher",
  "host_type": "python",
  "ui_type": "qt",
  "engine_name": "load_publish",
  "engine_type": "publisher",
  "validation_schema": "ToolSchema",
  "steps":[
    {
      "step_type": "context",
      "step_name": "main",
      "optional": false,
      "enabled": true,
      "stages": [
        {
          "stage_type": "context",
          "stage_name": "context",
          "optional": false,
          "enabled": true,
          "plugins": [
            {
                "plugin_type": "context",
                "plugin_title": "context selector",
                "plugin_name": "generic_context_passthrough",
                "widget_name": "publisher_context_selector"
            }
          ]
        }
      ]
    },
    {
      "step_type": "component",
      "step_name": "file",
      "optional": false,
      "enabled": true,
      "stages": [
        {
          "stage_type": "collector",
          "stage_name": "collector",
          "optional": false,
          "enabled": true,
          "plugins": [
            {
              "plugin_type": "collector",
              "plugin_title": "collect file",
              "plugin_name": "file_collector",
              "widget_name": "file_browser_collector",
              "options": {
                "folder_path": null,
                "file_name": null
              }
            }
          ]
        },
        {
          "stage_type": "validator",
          "stage_name": "validator",
          "optional": false,
          "enabled": true,
          "plugins": [
            {
              "plugin_type": "validator",
              "plugin_title": "validate file exists",
              "plugin_name": "file_exists_validator",
              "widget_name": "validator_check"
            }
          ]
        },
        {
          "stage_type": "exporter",
          "stage_name": "exporter",
          "optional": false,
          "enabled": true,
          "plugins": [
            {
              "plugin_type": "exporter",
              "plugin_title": "Export file",
              "plugin_name": "rename_file_exporter",
              "widget_name": "file_exporter_options",
              "options": {
                "export_destinations": "/Users/ftrack/Desktop/myPublishedFiile.png"
              }
            }
          ]
        }
      ]
    },
    {
      "step_type": "component",
      "step_name": "file_two",
      "optional": false,
      "enabled": true,
      "stages": [
        {
          "stage_type": "collector",
          "stage_name": "collector",
          "optional": false,
          "enabled": true,
          "plugins": [
            {
              "plugin_type": "collector",
              "plugin_title": "collect file",
              "plugin_name": "file_collector",
              "widget_name": "file_browser_collector",
              "options": {
                "folder_path": "/Users/ftrack/Desktop",
                "file_name": "file_collector_test.png"
              }
            }
          ]
        },
        {
          "stage_type": "validator",
          "stage_name": "validator",
          "optional": false,
          "enabled": true,
          "plugins": [
            {
              "plugin_type": "validator",
              "plugin_title": "validate file exists",
              "plugin_name": "file_exists_validator",
              "widget_name": "validator_check"
            }
          ]
        },
        {
          "stage_type": "exporter",
          "stage_name": "exporter",
          "optional": false,
          "enabled": true,
          "plugins": [
            {
              "plugin_type": "exporter",
              "plugin_title": "Export file",
              "plugin_name": "rename_file_exporter",
              "widget_name": "file_exporter_options",
              "options": {
                "export_destinations": "/Users/ftrack/Desktop/myPublishedFiile.png"
              }
            }
          ]
        }
      ]
    },
    {
      "step_type": "finalizer",
      "step_name": "main",
      "optional": false,
      "enabled": true,
      "stages": [
        {
          "stage_type": "pre_finalizer",
          "stage_name": "pre_finalizer",
          "optional": false,
          "enabled": true,
          "visible": false,
          "plugins": [
            {
              "plugin_type": "pre_finalizer",
              "plugin_title": "Pre publish to ftrack server",
              "plugin_name": "generic_passthrough"
            }
          ]
        },
        {
          "stage_type": "finalizer",
          "stage_name": "finalizer",
          "optional": false,
          "enabled": true,
          "visible": false,
          "plugins": [
            {
              "plugin_type": "finalizer",
              "plugin_title": "Publish to ftrack server",
              "plugin_name": "publish_to_ftrack"
            }
          ]
        },
        {
          "stage_type": "post_finalizer",
          "stage_name": "post_finalizer",
          "optional": false,
          "enabled": true,
          "visible": false,
          "plugins": [
            {
              "plugin_type": "post_finalizer",
              "plugin_title": "Post process publish",
              "plugin_name": "generic_passthrough"
            }
          ]
        }
      ]
    }
  ]
}