{
  "tool_type": "opener",
  "tool_title": "Document Opener",
  "host_type": "python",
  "ui_type": "qt",
  "engine_name": "load_publish",
  "engine_type": "opener",
  "validation_schema": "ToolSchema",
  "steps":[
    {
      "step_type": "context",
      "step_name": "main",
      "optional": false,
      "enabled": true,
      "stages": [
        {
          "stage_type": "context",
          "stage_name": "context",
          "optional": false,
          "enabled": true,
          "plugins": [
            {
                "plugin_type": "context",
                "plugin_title": "context selector",
                "plugin_name": "generic_context_passthrough"
            }
          ]
        }
      ]
    },
    {
      "step_type": "component",
      "step_name": "snapshot",
      "optional": false,
      "enabled": true,
      "stages": [
        {
          "stage_type": "collector",
          "stage_name": "collector",
          "optional": false,
          "enabled": true,
          "plugins": [
            {
              "plugin_type": "collector",
              "plugin_title": "collect file",
              "plugin_name": "path_collector",
              "widget_name": "item_browser_selector"
            }
          ]
        },
        {
          "stage_type": "importer",
          "stage_name": "importer",
          "optional": false,
          "enabled": true,
          "plugins": [
            {
              "plugin_type": "importer",
              "plugin_title": "open PS document",
              "plugin_name": "photoshop_document_opener"
            }
          ]
        },
        {
          "stage_type": "post_importer",
          "stage_name": "post_importer",
          "optional": false,
          "enabled": true,
          "plugins": [
            {
              "plugin_type": "post_importer",
              "plugin_title": "Set up document",
              "plugin_name": "setup_photoshop_document"
            }
          ]
        }
      ]
    },
    {
      "step_type": "finalizer",
      "step_name": "main",
      "optional": false,
      "enabled": true,
      "stages": [
        {
          "stage_type": "pre_finalizer",
          "stage_name": "pre_finalizer",
          "optional": false,
          "enabled": true,
          "visible": false,
          "plugins": [
            {
              "plugin_type": "pre_finalizer",
              "plugin_title": "Pre finalizer process",
              "plugin_name": "generic_passthrough"
            }
          ]
        },
        {
          "stage_type": "finalizer",
          "stage_name": "finalizer",
          "optional": false,
          "enabled": true,
          "visible": false,
          "plugins": [
            {
              "plugin_type": "finalizer",
              "plugin_title": "Finalizer process",
              "plugin_name": "photoshop_opener_finalizer"
            }
          ]
        },
        {
          "stage_type": "post_finalizer",
          "stage_name": "post_finalizer",
          "optional": false,
          "enabled": true,
          "visible": false,
          "plugins": [
            {
              "plugin_type": "post_finalizer",
              "plugin_title": "Post process publish",
              "plugin_name": "generic_passthrough"
            }
          ]
        }
      ]
    }
  ]
}