{
  "tool_type": "publisher",
  "tool_title": "Document publisher",
  "host_type": "photoshop",
  "ui_type": "qt",
  "engine_name": "load_publish",
  "engine_type": "publisher",
  "validation_schema": "ToolSchema",
  "steps":[
    {
      "step_type": "context",
      "step_name": "main",
      "optional": false,
      "enabled": true,
      "stages": [
        {
          "stage_type": "context",
          "stage_name": "context",
          "optional": false,
          "enabled": true,
          "plugins": [
            {
                "plugin_type": "context",
                "plugin_title": "context selector",
                "plugin_name": "generic_context_passthrough",
                "widget_name": "publisher_context_selector"
            }
          ]
        }
      ]
    },
    {
      "step_type": "component",
      "step_name": "snapshot",
      "optional": false,
      "enabled": true,
      "stages": [
        {
          "stage_type": "collector",
          "stage_name": "collector",
          "optional": false,
          "enabled": true,
          "plugins": [
            {
              "plugin_type": "collector",
              "plugin_title": "collect file",
              "plugin_name": "photoshop_document_publisher_collector",
              "options": {
                "export": ["document"]
              }
            }
          ]
        },
        {
          "stage_type": "validator",
          "stage_name": "validator",
          "optional": false,
          "enabled": true,
          "plugins": [
            {
              "plugin_type": "validator",
              "plugin_title": "validate document",
              "plugin_name": "photoshop_document_publisher_validator",
              "widget_name": "validator_check"
            }
          ]
        },
        {
          "stage_type": "exporter",
          "stage_name": "exporter",
          "optional": false,
          "enabled": true,
          "plugins": [
            {
              "plugin_type": "exporter",
              "plugin_title": "Export file",
              "plugin_name": "photoshop_native_publisher_exporter"
            }
          ]
        }
      ]
    },
    {
      "step_type": "component",
      "step_name": "reviewable",
      "optional": true,
      "enabled": true,
      "stages": [
        {
          "stage_type": "collector",
          "stage_name": "collector",
          "optional": false,
          "enabled": true,
          "plugins": [
            {
              "plugin_type": "collector",
              "plugin_title": "collect file",
              "plugin_name": "photoshop_document_publisher_collector",
              "options": {
                "export": ["document"]
              }
            }
          ]
        },
        {
          "stage_type": "validator",
          "stage_name": "validator",
          "optional": false,
          "enabled": true,
          "plugins": [
            {
              "plugin_type": "validator",
              "plugin_title": "validate document",
              "plugin_name": "photoshop_document_publisher_validator",
              "widget_name": "validator_check"
            }
          ]
        },
        {
          "stage_type": "exporter",
          "stage_name": "exporter",
          "optional": false,
          "enabled": true,
          "plugins": [
            {
              "plugin_type": "exporter",
              "plugin_title": "Export file",
              "plugin_name": "photoshop_image_publisher_exporter"
            }
          ]
        }
      ]
    },
    {
      "step_type": "finalizer",
      "step_name": "main",
      "optional": false,
      "enabled": true,
      "stages": [
        {
          "stage_type": "pre_finalizer",
          "stage_name": "pre_finalizer",
          "optional": false,
          "enabled": true,
          "visible": false,
          "plugins": [
            {
              "plugin_type": "pre_finalizer",
              "plugin_title": "Pre publish to ftrack server",
              "plugin_name": "generic_passthrough"
            }
          ]
        },
        {
          "stage_type": "finalizer",
          "stage_name": "finalizer",
          "optional": false,
          "enabled": true,
          "visible": false,
          "plugins": [
            {
              "plugin_type": "finalizer",
              "plugin_title": "Publish to ftrack server",
              "plugin_name": "publish_to_ftrack"
            }
          ]
        },
        {
          "stage_type": "post_finalizer",
          "stage_name": "post_finalizer",
          "optional": false,
          "enabled": true,
          "visible": false,
          "plugins": [
            {
              "plugin_type": "post_finalizer",
              "plugin_title": "Post process publish",
              "plugin_name": "generic_passthrough"
            }
          ]
        }
      ]
    }
  ]
}